name,start_date,end_date,description
Dotcom Bubble Burst,2000-03-10,2002-10-09,ฟองสบู่ดอทคอมแตก — Nasdaq ร่วง ~78% จากจุดสูงสุด
Global Financial Crisis (GFC),2007-10-09,2009-03-09,วิกฤตซับไพรม์ → ล่มสลายของ Lehman Brothers → ตลาดทั่วโลกร่วงหนัก
European Debt Crisis,2010-04-23,2012-07-24,วิกฤตหนี้สาธารณะยุโรป — กรีซ ไอร์แลนด์ โปรตุเกส สเปน
China Crash / Oil Crash,2015-06-12,2016-02-11,ตลาดหุ้นจีนร่วง + ราคาน้ำมันดิบตกต่ำสุดในรอบสิบปี
COVID-19 Pandemic Crash,2020-02-19,2020-03-23,ตลาดร่วงเร็วที่สุดในประวัติศาสตร์จากการระบาดของ COVID-19
2022 Rate Hike / Inflation Shock,2022-01-03,2022-10-12,Fed ขึ้นดอกเบี้ยเร็วที่สุดในรอบ 40 ปี — หุ้นและพันธบัตรร่วงพร้อมกัน
